{
  "receipt_version": "2.1",
  "artifact_type": "sofrs_report_validation_receipt",
  "receipt_kind": "SOFRS_VALIDATION_RECEIPT",
  "receipt_scope": "SOFRS_PROTOCOL_CONFORMANCE_ONLY",
  "receipt_id": "receipt.gridworld-f4-target-native-v2.sofrs-v2_1",
  "report": {
    "report_id": "gridworld-f4-target-native-v2",
    "sofrs_version": "2.1",
    "record_kind": "strict_sof",
    "artifact": {
      "uri": "experiments/paper13/results/v2.1/source-reports/reports/gridworld-f4-target.sofreport.json",
      "digest": {
        "algorithm": "sha256",
        "value": "96cd56fd1a4c7fbb383ed3f838b7f6252ff3eb645aff18a655fa89a38bea57b7"
      }
    }
  },
  "validator": {
    "validator_id": "sofrs.report-validator.v2_1",
    "validator_version": "2.1",
    "implementation": {
      "uri": "experiments/paper12/validation/validate_sofrs_v2_1.py",
      "digest": {
        "algorithm": "sha256",
        "value": "bd4a49eac44659c6f07e17899ebc72964f23fa7509a702107eca5ace769c7c4e"
      }
    },
    "report_contract": {
      "uri": "schemas/sofrs/v2.1.schema.json",
      "digest": {
        "algorithm": "sha256",
        "value": "cb7803deff08d7f93e36d2d1157e2bcf9563048ccf5ee28fd9a16d82cb1993da"
      }
    },
    "receipt_contract": {
      "uri": "schemas/sofrs/report-validation-receipt-v2.1.schema.json",
      "digest": {
        "algorithm": "sha256",
        "value": "defd2bcaaac9d5f1a1ff2907494b35dfb853ca729244dced733a6329e69f6820"
      }
    }
  },
  "generation": {
    "kind": "migration",
    "class": "boundary_annotation",
    "source_version": "2.0",
    "source_artifact": {
      "uri": "experiments/paper13/results/native/gridworld-f4/source-reports/reports/gridworld-f4-target.sofreport.json",
      "digest": {
        "algorithm": "sha256",
        "value": "5088aafe17b283bc3be1c62919ecd9ba11dcbcda09df81676c2d2cf72fd32c9f"
      }
    },
    "source_validation_receipt": {
      "uri": "experiments/paper13/results/native/gridworld-f4/source-reports/receipts/gridworld-f4-target.validation-receipt.json",
      "digest": {
        "algorithm": "sha256",
        "value": "1d785730ed0dda2bfbbd0014dd6ed472375e53b5e1a8a235136bf037b9cde0f1"
      }
    },
    "implementation": {
      "uri": "experiments/paper12/validation/migrate_sofrs_v2_to_v2_1.py",
      "digest": {
        "algorithm": "sha256",
        "value": "b800f6f0362e98cf24b4c81e1faaa54714fac7e814fb7dcb9c522cd0a2ebecb4"
      }
    }
  },
  "artifact_closure": {
    "artifact_count": 18,
    "ordered_artifacts": [
      {
        "role": "report",
        "artifact": {
          "uri": "experiments/paper13/results/v2.1/source-reports/reports/gridworld-f4-target.sofreport.json",
          "digest": {
            "algorithm": "sha256",
            "value": "96cd56fd1a4c7fbb383ed3f838b7f6252ff3eb645aff18a655fa89a38bea57b7"
          }
        }
      },
      {
        "role": "revision-source-report-v2.0",
        "artifact": {
          "uri": "experiments/paper13/results/native/gridworld-f4/source-reports/reports/gridworld-f4-target.sofreport.json",
          "digest": {
            "algorithm": "sha256",
            "value": "5088aafe17b283bc3be1c62919ecd9ba11dcbcda09df81676c2d2cf72fd32c9f"
          }
        }
      },
      {
        "role": "source-validation-receipt-v2.0",
        "artifact": {
          "uri": "experiments/paper13/results/native/gridworld-f4/source-reports/receipts/gridworld-f4-target.validation-receipt.json",
          "digest": {
            "algorithm": "sha256",
            "value": "1d785730ed0dda2bfbbd0014dd6ed472375e53b5e1a8a235136bf037b9cde0f1"
          }
        }
      },
      {
        "role": "migration-implementation",
        "artifact": {
          "uri": "experiments/paper12/validation/migrate_sofrs_v2_to_v2_1.py",
          "digest": {
            "algorithm": "sha256",
            "value": "b800f6f0362e98cf24b4c81e1faaa54714fac7e814fb7dcb9c522cd0a2ebecb4"
          }
        }
      },
      {
        "role": "legacy-v2-validator",
        "artifact": {
          "uri": "experiments/paper12/validation/validate_sofrs_v2.py",
          "digest": {
            "algorithm": "sha256",
            "value": "e3b21ed183acd489a4d925c4cd8ec127121c70ba3b10f0e13689baa47900173f"
          }
        }
      },
      {
        "role": "legacy-v2-report-contract",
        "artifact": {
          "uri": "schemas/sofrs/v2.0.schema.json",
          "digest": {
            "algorithm": "sha256",
            "value": "8a751bd62a2746b334c81a394e6dce1cb1a9251c978aa723aef69c602dce098e"
          }
        }
      },
      {
        "role": "legacy-v2-receipt-contract",
        "artifact": {
          "uri": "schemas/sofrs/report-validation-receipt-v2.0.schema.json",
          "digest": {
            "algorithm": "sha256",
            "value": "84254cf908ce21a5d8ab6267e7e5c9a0b06bca3aa8caaa9246e1f9b492855647"
          }
        }
      },
      {
        "role": "v2-receipt-api",
        "artifact": {
          "uri": "schemas/sofrs/api.py",
          "digest": {
            "algorithm": "sha256",
            "value": "5f4e7f5e55944aa826a8c1977f501452f0680b4b9adec22f9e8ae16bed249e78"
          }
        }
      },
      {
        "role": "boundary-helper",
        "artifact": {
          "uri": "schemas/non_intervention.py",
          "digest": {
            "algorithm": "sha256",
            "value": "0e161d1450b310ac099ed62a7ad2914110a403a9bdd2aa37ec1d2b1a8335c857"
          }
        }
      },
      {
        "role": "report-contract",
        "artifact": {
          "uri": "schemas/sofrs/v2.1.schema.json",
          "digest": {
            "algorithm": "sha256",
            "value": "cb7803deff08d7f93e36d2d1157e2bcf9563048ccf5ee28fd9a16d82cb1993da"
          }
        }
      },
      {
        "role": "capability-manifest",
        "artifact": {
          "uri": "experiments/paper13/results/native/gridworld-f4/source-reports/manifests/gridworld-f4-target.capabilities.json",
          "digest": {
            "algorithm": "sha256",
            "value": "80fa32d16440e6bf70ece8833affb9dd2b3121bb40387778edf20d04182b6621"
          }
        }
      },
      {
        "role": "typed-sof-ir",
        "artifact": {
          "uri": "experiments/paper13/results/native/gridworld-f4/source-reports/ir/gridworld-f4-target.ir.json",
          "digest": {
            "algorithm": "sha256",
            "value": "7237d4f3da81f5ac84b363716e45ca3359c5f6643e0cd1ca2dd2e9ffcbbd1d96"
          }
        }
      },
      {
        "role": "compiler-profile",
        "artifact": {
          "uri": "schemas/sofrs/paper12-strict-compiler-profile-v1.0.json",
          "digest": {
            "algorithm": "sha256",
            "value": "c80d1d963740a125ec8c0d1338a1d04084095f1d0aa55f708336c5e7a1fbc792"
          }
        }
      },
      {
        "role": "compiler-output",
        "artifact": {
          "uri": "experiments/paper13/results/native/gridworld-f4/source-reports/compiler-output/gridworld-f4-target.compiler-output.json",
          "digest": {
            "algorithm": "sha256",
            "value": "5851f049659f49ae720c675eec5a686c8c56db904f89a86ab5af1b917469c1aa"
          }
        }
      },
      {
        "role": "assembly-profile",
        "artifact": {
          "uri": "schemas/sofrs/paper12-strict-assembly-profile-v2.0.json",
          "digest": {
            "algorithm": "sha256",
            "value": "61840c7f29bd62e8ede194c87069aa1b9dc488f4cc93310ba02588468fbae4f1"
          }
        }
      },
      {
        "role": "assembly-implementation",
        "artifact": {
          "uri": "experiments/paper13/validation/gridworld_f4_native_v2.py",
          "digest": {
            "algorithm": "sha256",
            "value": "d97955cbdfae68b872a7b9a88da4f30aa26c742f230dc08960101f7ee392e194"
          }
        }
      },
      {
        "role": "validator-implementation",
        "artifact": {
          "uri": "experiments/paper12/validation/validate_sofrs_v2_1.py",
          "digest": {
            "algorithm": "sha256",
            "value": "bd4a49eac44659c6f07e17899ebc72964f23fa7509a702107eca5ace769c7c4e"
          }
        }
      },
      {
        "role": "validation-receipt-contract",
        "artifact": {
          "uri": "schemas/sofrs/report-validation-receipt-v2.1.schema.json",
          "digest": {
            "algorithm": "sha256",
            "value": "defd2bcaaac9d5f1a1ff2907494b35dfb853ca729244dced733a6329e69f6820"
          }
        }
      }
    ],
    "closure_digest": {
      "algorithm": "sha256",
      "value": "75e36429dbb7ea4aef59cf2256c7d44329e12e93776705124714797c572a0472"
    }
  },
  "status": "PASS",
  "checks": [
    {
      "check_id": "artifact-closure",
      "status": "PASS"
    },
    {
      "check_id": "assembly-faithfulness",
      "status": "PASS"
    },
    {
      "check_id": "claim-compatibility",
      "status": "PASS"
    },
    {
      "check_id": "degradation-semantics",
      "status": "PASS"
    },
    {
      "check_id": "explicit-v2.0-to-v2.1-migration",
      "status": "PASS"
    },
    {
      "check_id": "forbidden-semantic-role-scan",
      "status": "PASS"
    },
    {
      "check_id": "report-non-intervention",
      "status": "PASS"
    },
    {
      "check_id": "schema-validation",
      "status": "PASS"
    },
    {
      "check_id": "v2.0-source-validation",
      "status": "PASS"
    }
  ],
  "object_transition_boundary": {
    "intervention_semantics": "NONE",
    "source_state_transition_authority": "NONE",
    "implementation_purity_status": "NOT_ESTABLISHED_BY_SOFRS"
  },
  "negative_boundaries": [
    "This receipt establishes SOFRS protocol conformance only; it neither induces nor authorizes an object-state transition, and it does not establish implementation purity."
  ]
}
